{
  "$schema": "./workflow-graph.schema.json",
  "authority": {
    "markdown_role": "bidirectionally-checked-documentation-only",
    "node_source": "references/system-catalog.json",
    "node_source_sha256": "d9320294ffb04ef5e90bc6763637483361114a77f8ed6e4542cc2d5cd95b2d1a",
    "source": "references/workflow-graph.source.json",
    "source_sha256": "d9dd3a6534a137a99bb8e5c14d6d040390872d3699bae61e11be71178e71a0fe"
  },
  "automatic_handoff_policy": {
    "ambiguity_stop": true,
    "max_automatic_handoffs": 3,
    "visited_set_required": true
  },
  "catalog_version": "20.2.0",
  "counts": {
    "edges": 378,
    "nodes": 120,
    "workflows": 1
  },
  "edge_shards": [
    {
      "edge_count": 40,
      "first_edge_id": "ad-account-auditor--attribution-reconciler",
      "id": "edges-00",
      "last_edge_id": "campaign-architect--ad-creative-builder",
      "ref": "references/workflow-graph/edges-00.json",
      "sha256": "ecc142650657e11f0db93da0d935bc2b0f4acdae27cad5c88d6e7b79a330191a"
    },
    {
      "edge_count": 40,
      "first_edge_id": "campaign-architect--ad-test-designer",
      "id": "edges-01",
      "last_edge_id": "content-quality-auditor--technical-seo-checker",
      "ref": "references/workflow-graph/edges-01.json",
      "sha256": "48cfcf896ec1706f50b908aee71590388f23897c2ac0915256a9736670764b8a"
    },
    {
      "edge_count": 40,
      "first_edge_id": "content-writer--content-quality-auditor",
      "id": "edges-02",
      "last_edge_id": "email-creative-builder--email-quality-auditor",
      "ref": "references/workflow-graph/edges-02.json",
      "sha256": "e8cadc6b1deb38ffd81d846685857a987d544893dabd04fe3570613d3509b2f5"
    },
    {
      "edge_count": 40,
      "first_edge_id": "email-creative-builder--landing-optimizer",
      "id": "edges-03",
      "last_edge_id": "influencer-discovery--fit-scorer",
      "ref": "references/workflow-graph/edges-03.json",
      "sha256": "b809c2d830bfe0f515168be933a6eb34034fa7cbd5433bb09bdb440d218adc2d"
    },
    {
      "edge_count": 40,
      "first_edge_id": "keyword-research--competitor-analysis",
      "id": "edges-04",
      "last_edge_id": "list-growth-designer--email-sequence-designer",
      "ref": "references/workflow-graph/edges-04.json",
      "sha256": "6693a90856c1fd05a664c0c49a37508d9a86c7697ab3f0758d14689c4a1b3c47"
    },
    {
      "edge_count": 40,
      "first_edge_id": "list-growth-designer--landing-optimizer",
      "id": "edges-05",
      "last_edge_id": "narrative-enablement-kit--pitch-narrative-builder",
      "ref": "references/workflow-graph/edges-05.json",
      "sha256": "91a0a0ea92245f95360e54421a3454c7202e042de31b74c98f6397d9245bc55f"
    },
    {
      "edge_count": 40,
      "first_edge_id": "narrative-quality-auditor--message-system-architect",
      "id": "edges-06",
      "last_edge_id": "performance-analyzer--roi-calculator",
      "ref": "references/workflow-graph/edges-06.json",
      "sha256": "e7dacc20bdb99d2b0996e7ca3b9ecd5d4a2d0645e228fccb3f99fd7c0a24d666"
    },
    {
      "edge_count": 40,
      "first_edge_id": "performance-monitor--content-quality-auditor",
      "id": "edges-07",
      "last_edge_id": "roi-calculator--budget-optimizer",
      "ref": "references/workflow-graph/edges-07.json",
      "sha256": "5c6f8e3eba1db7f51484af75ab1d0427356745a770efdeea71868b7494130224"
    },
    {
      "edge_count": 40,
      "first_edge_id": "roi-calculator--performance-analyzer",
      "id": "edges-08",
      "last_edge_id": "story-bank-builder--narrative-cascade-planner",
      "ref": "references/workflow-graph/edges-08.json",
      "sha256": "b4c35b905f2836fdd309b04f42bbe944f441558b52a95bb2c9724286dd923eeb"
    },
    {
      "edge_count": 18,
      "first_edge_id": "story-bank-builder--offer-claims-registry",
      "id": "edges-09",
      "last_edge_id": "campaign-planner--performance-analyzer",
      "ref": "references/workflow-graph/edges-09.json",
      "sha256": "b047a123ec78458ac8e107ecd71e49dc3188cc7b32d7e00540bd41f09665ccb5"
    }
  ],
  "graph_sha256": "f2135af37a367bf7451d66d1cb88333f5ac4d0608c7dc292cbefa64c888eafdb",
  "nodes": [
    {
      "discipline": "narrative",
      "entrypoint": true,
      "exception": null,
      "id": "narrative-baseline-mapper",
      "layer": "L1",
      "path": "narrative/trace/narrative-baseline-mapper/SKILL.md",
      "phase": "trace",
      "phase_index": 0,
      "stopping_mode": "natural-stop",
      "terminal": false
    },
    {
      "discipline": "narrative",
      "entrypoint": true,
      "exception": null,
      "id": "category-narrative-mapper",
      "layer": "L1",
      "path": "narrative/trace/category-narrative-mapper/SKILL.md",
      "phase": "trace",
      "phase_index": 0,
      "stopping_mode": "natural-stop",
      "terminal": false
    },
    {
      "discipline": "narrative",
      "entrypoint": true,
      "exception": null,
      "id": "audience-belief-mapper",
      "layer": "L1",
      "path": "narrative/trace/audience-belief-mapper/SKILL.md",
      "phase": "trace",
      "phase_index": 0,
      "stopping_mode": "natural-stop",
      "terminal": false
    },
    {
      "discipline": "narrative",
      "entrypoint": true,
      "exception": null,
      "id": "positioning-truth-tracer",
      "layer": "L1",
      "path": "narrative/trace/positioning-truth-tracer/SKILL.md",
      "phase": "trace",
      "phase_index": 0,
      "stopping_mode": "natural-stop",
      "terminal": false
    },
    {
      "discipline": "narrative",
      "entrypoint": true,
      "exception": null,
      "id": "strategic-narrative-designer",
      "layer": "L1",
      "path": "narrative/architect/strategic-narrative-designer/SKILL.md",
      "phase": "architect",
      "phase_index": 1,
      "stopping_mode": "natural-stop",
      "terminal": false
    },
    {
      "discipline": "narrative",
      "entrypoint": true,
      "exception": null,
      "id": "message-system-architect",
      "layer": "L1",
      "path": "narrative/architect/message-system-architect/SKILL.md",
      "phase": "architect",
      "phase_index": 1,
      "stopping_mode": "natural-stop",
      "terminal": false
    },
    {
      "discipline": "narrative",
      "entrypoint": true,
      "exception": null,
      "id": "brand-language-codifier",
      "layer": "L1",
      "path": "narrative/architect/brand-language-codifier/SKILL.md",
      "phase": "architect",
      "phase_index": 1,
      "stopping_mode": "natural-stop",
      "terminal": false
    },
    {
      "discipline": "narrative",
      "entrypoint": true,
      "exception": null,
      "id": "story-bank-builder",
      "layer": "L1",
      "path": "narrative/architect/story-bank-builder/SKILL.md",
      "phase": "architect",
      "phase_index": 1,
      "stopping_mode": "natural-stop",
      "terminal": false
    },
    {
      "discipline": "narrative",
      "entrypoint": true,
      "exception": null,
      "id": "narrative-cascade-planner",
      "layer": "L1",
      "path": "narrative/land/narrative-cascade-planner/SKILL.md",
      "phase": "land",
      "phase_index": 2,
      "stopping_mode": "natural-stop",
      "terminal": false
    },
    {
      "discipline": "narrative",
      "entrypoint": true,
      "exception": null,
      "id": "pitch-narrative-builder",
      "layer": "L1",
      "path": "narrative/land/pitch-narrative-builder/SKILL.md",
      "phase": "land",
      "phase_index": 2,
      "stopping_mode": "natural-stop",
      "terminal": false
    },
    {
      "discipline": "narrative",
      "entrypoint": true,
      "exception": null,
      "id": "narrative-enablement-kit",
      "layer": "L1",
      "path": "narrative/land/narrative-enablement-kit/SKILL.md",
      "phase": "land",
      "phase_index": 2,
      "stopping_mode": "natural-stop",
      "terminal": false
    },
    {
      "discipline": "narrative",
      "entrypoint": true,
      "exception": null,
      "id": "proof-point-packager",
      "layer": "L1",
      "path": "narrative/land/proof-point-packager/SKILL.md",
      "phase": "land",
      "phase_index": 2,
      "stopping_mode": "natural-stop",
      "terminal": false
    },
    {
      "discipline": "narrative",
      "entrypoint": true,
      "exception": null,
      "id": "narrative-quality-auditor",
      "layer": "L1",
      "path": "narrative/evaluate/narrative-quality-auditor/SKILL.md",
      "phase": "evaluate",
      "phase_index": 3,
      "stopping_mode": "human-decision",
      "terminal": false
    },
    {
      "discipline": "narrative",
      "entrypoint": true,
      "exception": null,
      "id": "message-test-designer",
      "layer": "L1",
      "path": "narrative/evaluate/message-test-designer/SKILL.md",
      "phase": "evaluate",
      "phase_index": 3,
      "stopping_mode": "natural-stop",
      "terminal": false
    },
    {
      "discipline": "narrative",
      "entrypoint": true,
      "exception": null,
      "id": "narrative-resonance-monitor",
      "layer": "L1",
      "path": "narrative/evaluate/narrative-resonance-monitor/SKILL.md",
      "phase": "evaluate",
      "phase_index": 3,
      "stopping_mode": "natural-stop",
      "terminal": false
    },
    {
      "discipline": "narrative",
      "entrypoint": true,
      "exception": null,
      "id": "narrative-drift-monitor",
      "layer": "L1",
      "path": "narrative/evaluate/narrative-drift-monitor/SKILL.md",
      "phase": "evaluate",
      "phase_index": 3,
      "stopping_mode": "natural-stop",
      "terminal": false
    },
    {
      "discipline": "seo-geo",
      "entrypoint": true,
      "exception": null,
      "id": "keyword-research",
      "layer": "L2",
      "path": "seo-geo/survey/keyword-research/SKILL.md",
      "phase": "survey",
      "phase_index": 0,
      "stopping_mode": "natural-stop",
      "terminal": false
    },
    {
      "discipline": "seo-geo",
      "entrypoint": true,
      "exception": null,
      "id": "competitor-analysis",